ANNOUNCEMENT: We're making some changes to how comics are handled.	funny	0	0.98	public	2491	False	2491	1623683699.0	False	False	nzp2n0	False	hot	2022-02-28 20:57:33
Subreddit Of The Month [February 2022]: /r/soccercirclejerk. Know of a small (under 20,000 subscribers) humor-based subreddit that deserves a month in the spotlight? Link it inside!	funny	0	0.94	public	289	False	289	1643896429.0	False	False	sjjqsi	False	hot	2022-02-28 20:57:33
Alcohol	funny	0	0.82	public	33628	False	33628	1646062914.0	False	False	t3ifqx	False	hot	2022-02-28 20:57:33
Isolated	funny	0	0.82	public	54284	False	54284	1646051423.0	False	False	t3ej6y	False	hot	2022-02-28 20:57:33
Pranking your bald freind	funny	0	0.88	public	22576	False	22576	1646051993.0	False	False	t3epbp	True	hot	2022-02-28 20:57:33
"I attempted to pitch-correct Smash Mouth's ""All Star"" into Canon in D"	funny	0	0.93	public	4538	False	4538	1646065828.0	False	False	t3jj19	True	hot	2022-02-28 20:57:33
FYI Australia is flooding again.	funny	0	0.97	public	5269	False	5269	1646048039.0	False	False	t3djz2	False	hot	2022-02-28 20:57:33
First taste of actual food was clearly a hit!	funny	0	0.94	public	1765	False	1765	1646066861.0	False	False	t3jwlq	True	hot	2022-02-28 20:57:33
My friend is a paraplegic and wore his Christmas gift for the first time. Everyone seems to approve of it!	funny	0	0.93	public	33411	False	33411	1646010892.0	False	False	t332bd	False	hot	2022-02-28 20:57:33
My friend landed five feet from the hole and he got to try for his first birdie ever	funny	0	0.96	public	12835	False	12835	1646012670.0	False	False	t33mz9	True	hot	2022-02-28 20:57:33
If you need me, I will be in the right testicles	funny	0	0.95	public	1949	False	1949	1646039281.0	False	False	t3bfei	False	hot	2022-02-28 20:57:33
One of these things is not a cat	funny	0	0.93	public	650	False	650	1646059450.0	False	False	t3h6ro	False	hot	2022-02-28 20:57:33
One donut to rule them all!	funny	0	0.94	public	281	False	281	1646074840.0	False	False	t3n0gv	False	hot	2022-02-28 20:57:33
Ah yes, Wendy's, where we value our employees.	funny	0	0.92	public	420	False	420	1646064678.0	False	False	t3j3wx	False	hot	2022-02-28 20:57:33
I was reading reviews for dog bones on Amazon and...	funny	0	0.93	public	246	False	246	1646071040.0	False	False	t3lik7	False	hot	2022-02-28 20:57:33
Ant Story!	funny	0	0.86	public	322	False	322	1646064605.0	False	False	t3j2vt	False	hot	2022-02-28 20:57:33
My husband went to pick up a few groceries alone. I got a call from him for advice every few minutes.	funny	0	0.89	public	10872	False	10872	1646004388.0	False	False	t30uem	False	hot	2022-02-28 20:57:33
My Dietician told me to use smaller plates for my meals, which would help me control my portion size…	funny	0	0.85	public	229	False	229	1646069990.0	False	False	t3l3xe	False	hot	2022-02-28 20:57:33
Hilarious indian british comedy	funny	0	0.89	public	159	False	159	1646075442.0	False	False	t3n8r5	True	hot	2022-02-28 20:57:33
I asked him what was wrong and he said, “I can’t”	funny	0	0.93	public	143	False	143	1646074862.0	False	False	t3n0rz	False	hot	2022-02-28 20:57:33
Sunday night	funny	0	0.9	public	57939	False	57939	1645989929.0	False	False	t2vojy	False	hot	2022-02-28 20:57:33
heavy is the burger that wears the crown	funny	0	0.97	public	99	False	99	1646079456.0	False	False	t3ot9p	False	hot	2022-02-28 20:57:33
Live, laugh, love and here’s a tree	funny	0	0.95	public	136	False	136	1646070981.0	False	False	t3lhrs	False	hot	2022-02-28 20:57:33
I saw this graffiti on a pier a couple years ago and I still think about it often	funny	0	0.94	public	2659	False	2659	1646012943.0	False	False	t33q4t	False	hot	2022-02-28 20:57:33
he is so nice :)	funny	0	0.89	public	102	False	102	1646075365.0	False	False	t3n7ls	True	hot	2022-02-28 20:57:33
Bear Hug	funny	0	0.91	public	319	False	319	1646052092.0	False	False	t3eqfl	False	hot	2022-02-28 20:57:33
Colonoscopy tomorrow, clear liquid diet today. So I'm making myself a nice, peach jello on jello sandwich.	funny	0	0.93	public	14606	False	14606	1645988268.0	False	False	t2v2zh	False	hot	2022-02-28 20:57:33
Buddy asked me to touch up his old science fair photo.... Didn't say how, though.	funny	0	0.99	public	70	False	70	1646079652.0	False	False	t3ow17	False	hot	2022-02-28 20:57:33
How my employer gave us his two week notice....	funny	0	0.93	public	1654	False	1654	1646017563.0	False	False	t359ic	False	hot	2022-02-28 20:57:33
Cybernetic arm. [OC]	funny	0	0.96	public	4672	False	4672	1645998083.0	False	False	t2ylr5	False	hot	2022-02-28 20:57:33
is ✨fashion✨ [OC]	funny	0	0.92	public	117	False	117	1646067518.0	False	False	t3k5n4	False	hot	2022-02-28 20:57:33
Dark side of DIY	funny	0	0.94	public	866	False	866	1646027774.0	False	False	t38f0i	False	hot	2022-02-28 20:57:33
Dark Bidding [OC]	funny	0	0.94	public	1113	False	1113	1646021931.0	False	False	t36nmr	False	hot	2022-02-28 20:57:33
Mugged by a fox! 🦊😪😪	funny	0	0.87	public	69	False	69	1646075211.0	False	False	t3n5j8	True	hot	2022-02-28 20:57:33
ron	funny	0	0.87	public	163	False	163	1646054680.0	False	False	t3fjr9	False	hot	2022-02-28 20:57:33
Never Before Seen Lunchables Commercial...	funny	0	0.83	public	58	False	58	1646074833.0	True	False	t3n0dw	True	hot	2022-02-28 20:57:33
More fun than the nba slam dunk contest	funny	0	0.84	public	158	False	158	1646053675.0	False	False	t3f87v	True	hot	2022-02-28 20:57:33
And no, I didn't leave a voicemail	funny	0	0.9	public	66173	False	66173	1645970169.0	False	False	t2oqhw	False	hot	2022-02-28 20:57:33
Not sure who’s worse off here.	funny	0	0.75	public	94	False	94	1646062064.0	False	False	t3i4j0	False	hot	2022-02-28 20:57:33
A Siri’ously meet cute	funny	0	0.81	public	95	False	95	1646059279.0	False	False	t3h4mg	False	hot	2022-02-28 20:57:33
I freaked out, but then remembered she has to scissors	funny	0	0.72	public	67	False	67	1646066475.0	False	False	t3jrk3	False	hot	2022-02-28 20:57:33
Other Side of Nature (quick sample)	funny	0	0.87	public	28	False	28	1646078953.0	False	False	t3om4j	False	hot	2022-02-28 20:57:33
Spotted this review whilst lingerie shopping today!	funny	0	0.85	public	85	False	85	1646057344.0	False	False	t3gg5l	False	hot	2022-02-28 20:57:33
This putt-putt golf course is naughty!	funny	0	0.86	public	35	False	35	1646074439.0	True	False	t3muoi	False	hot	2022-02-28 20:57:33
Kids Say The Darndest Things	funny	0	0.72	public	50	False	50	1646068089.0	False	False	t3kdnk	False	hot	2022-02-28 20:57:33
What is this trick called?	funny	0	0.79	public	69	False	69	1646058799.0	False	False	t3gymg	False	hot	2022-02-28 20:57:33
Painful, but worth it	funny	0	0.92	public	1975	False	1975	1645991808.0	True	False	t2wcpy	False	hot	2022-02-28 20:57:33
Hootie had an unexpected spider visitor in her box this morning	funny	0	0.91	public	41	False	41	1646067649.0	False	False	t3k7ky	False	hot	2022-02-28 20:57:33
love the one you're with	funny	0	0.92	public	1367	False	1367	1645996891.0	False	False	t2y65s	False	hot	2022-02-28 20:57:33
Is this what they meant about blind squirrels?	funny	0	0.84	public	38	False	38	1646067019.0	True	False	t3jyrx	False	hot	2022-02-28 20:57:33
this sexy frog at the antique mall	funny	0	0.91	public	45	False	45	1646062217.0	False	False	t3i6gt	False	hot	2022-02-28 20:57:33
Female Hotness Index	funny	0	0.62	public	18	False	18	1646077868.0	False	False	t3o6ik	False	hot	2022-02-28 20:57:33
